{
  "$schema": "https://json-schema.org/draft-07/schema#",
  "version": "1.0.0",
  "lastUpdated": "2025-11-05",
  "categories": [
    {
      "id": "development",
      "name": "開発・プログラミング",
      "nameEn": "Development & Programming",
      "icon": "🔧",
      "services": [
        {
          "id": "github-pro",
          "name": "GitHub Pro",
          "provider": "GitHub",
          "type": "subscription",
          "discount": {
            "type": "free",
            "duration": "2年間",
            "originalPrice": null,
            "studentPrice": 0,
            "currency": "JPY"
          },
          "eligibility": {
            "studentTypes": ["大学生", "大学院生", "専門学校生", "高等専門学校生"],
            "requirements": ["学生証明"]
          },
          "verificationMethod": "GitHub Student Developer Pack",
          "url": "https://education.github.com/pack",
          "status": "active",
          "lastVerified": null,
          "notes": "GitHub Student Developer Packで2年間無料"
        },
        {
          "id": "github-copilot",
          "name": "GitHub Copilot",
          "provider": "GitHub",
          "type": "subscription",
          "discount": {
            "type": "free",
            "duration": "学生期間中",
            "originalPrice": null,
            "studentPrice": 0,
            "currency": "JPY"
          },
          "eligibility": {
            "studentTypes": ["学生"],
            "requirements": ["学生証明"]
          },
          "verificationMethod": "GitHub Student Developer Pack",
          "url": "https://education.github.com/pack",
          "status": "active",
          "lastVerified": null,
          "notes": "学生は無料で利用可能"
        },
        {
          "id": "jetbrains-intellij",
          "name": "IntelliJ IDEA",
          "provider": "JetBrains",
          "type": "license",
          "discount": {
            "type": "free",
            "duration": "学生・教職員期間中",
            "originalPrice": null,
            "studentPrice": 0,
            "currency": "JPY"
          },
          "eligibility": {
            "studentTypes": ["学生", "教職員"],
            "requirements": ["認定された教育機関の学生・教職員"]
          },
          "verificationMethod": "学生証明書",
          "url": "https://www.jetbrains.com/ja-jp/community/education/",
          "status": "active",
          "lastVerified": null,
          "notes": "学生・教職員向け無料ライセンス"
        },
        {
          "id": "jetbrains-pycharm",
          "name": "PyCharm",
          "provider": "JetBrains",
          "type": "license",
          "discount": {
            "type": "free",
            "duration": "学生・教職員期間中",
            "originalPrice": null,
            "studentPrice": 0,
            "currency": "JPY"
          },
          "eligibility": {
            "studentTypes": ["学生", "教職員"],
            "requirements": ["認定された教育機関の学生・教職員"]
          },
          "verificationMethod": "学生証明書",
          "url": "https://www.jetbrains.com/ja-jp/community/education/",
          "status": "active",
          "lastVerified": null,
          "notes": "学生・教職員向け無料ライセンス"
        },
        {
          "id": "jetbrains-webstorm",
          "name": "WebStorm",
          "provider": "JetBrains",
          "type": "license",
          "discount": {
            "type": "free",
            "duration": "学生・教職員期間中",
            "originalPrice": null,
            "studentPrice": 0,
            "currency": "JPY"
          },
          "eligibility": {
            "studentTypes": ["学生", "教職員"],
            "requirements": ["認定された教育機関の学生・教職員"]
          },
          "verificationMethod": "学生証明書",
          "url": "https://www.jetbrains.com/ja-jp/community/education/",
          "status": "active",
          "lastVerified": null,
          "notes": "学生・教職員向け無料ライセンス"
        },
        {
          "id": "jetbrains-clion",
          "name": "CLion",
          "provider": "JetBrains",
          "type": "license",
          "discount": {
            "type": "free",
            "duration": "学生・教職員期間中",
            "originalPrice": null,
            "studentPrice": 0,
            "currency": "JPY"
          },
          "eligibility": {
            "studentTypes": ["学生", "教職員"],
            "requirements": ["認定された教育機関の学生・教職員"]
          },
          "verificationMethod": "学生証明書",
          "url": "https://www.jetbrains.com/ja-jp/community/education/",
          "status": "active",
          "lastVerified": null,
          "notes": "学生・教職員向け無料ライセンス"
        },
        {
          "id": "microsoft-visual-studio",
          "name": "Visual Studio",
          "provider": "Microsoft",
          "type": "license",
          "discount": {
            "type": "free",
            "duration": "学生期間中",
            "originalPrice": null,
            "studentPrice": 0,
            "currency": "JPY"
          },
          "eligibility": {
            "studentTypes": ["学生"],
            "requirements": ["学生証明"]
          },
          "verificationMethod": "学生証明書",
          "url": "https://visualstudio.microsoft.com/ja/vs/community/",
          "status": "active",
          "lastVerified": null,
          "notes": "学生向け無料ライセンス"
        },
        {
          "id": "microsoft-azure",
          "name": "Azure",
          "provider": "Microsoft",
          "type": "credit",
          "discount": {
            "type": "credit",
            "duration": "学生期間中",
            "originalPrice": null,
            "studentPrice": 0,
            "currency": "JPY"
          },
          "eligibility": {
            "studentTypes": ["学生"],
            "requirements": ["学生証明"]
          },
          "verificationMethod": "学生証明書",
          "url": "https://azure.microsoft.com/ja-jp/free/students/",
          "status": "active",
          "lastVerified": null,
          "notes": "学生向け無料クレジット"
        },
        {
          "id": "microsoft-office365-education",
          "name": "Office 365 Education",
          "provider": "Microsoft",
          "type": "subscription",
          "discount": {
            "type": "free",
            "duration": "学生・教職員期間中",
            "originalPrice": null,
            "studentPrice": 0,
            "currency": "JPY"
          },
          "eligibility": {
            "studentTypes": ["学生", "教職員"],
            "requirements": ["教育機関のメールアドレス"]
          },
          "verificationMethod": "学校メールアドレス",
          "url": "https://www.microsoft.com/ja-jp/education/products/office",
          "status": "active",
          "lastVerified": null,
          "notes": "学生・教職員向け無料"
        }
      ]
    },
    {
      "id": "creative",
      "name": "クリエイティブ・デザイン",
      "nameEn": "Creative & Design",
      "icon": "🎨",
      "services": [
        {
          "id": "adobe-creative-cloud",
          "name": "Adobe Creative Cloud",
          "provider": "Adobe",
          "type": "subscription",
          "discount": {
            "type": "percentage",
            "percentOff": 60,
            "duration": "学生・教職員期間中",
            "originalPrice": null,
            "studentPrice": null,
            "currency": "JPY"
          },
          "eligibility": {
            "studentTypes": ["高校生", "高専生", "専門学校生", "短大生", "大学生", "大学院生", "教職員"],
            "requirements": ["高等学校、高等専門学校、専門学校、短期大学、大学、大学院"]
          },
          "verificationMethod": "学生証明書",
          "url": "https://www.adobe.com/jp/creativecloud/buy/students.html",
          "status": "active",
          "lastVerified": null,
          "notes": "学生・教職員向け60%オフ"
        },
        {
          "id": "autodesk-autocad",
          "name": "AutoCAD",
          "provider": "Autodesk",
          "type": "license",
          "discount": {
            "type": "free",
            "duration": "学生・教職員期間中",
            "originalPrice": null,
            "studentPrice": 0,
            "currency": "JPY"
          },
          "eligibility": {
            "studentTypes": ["学生", "教職員"],
            "requirements": ["認定教育機関"]
          },
          "verificationMethod": "学生証明書",
          "url": "https://www.autodesk.co.jp/education/edu-software/overview",
          "status": "active",
          "lastVerified": null,
          "notes": "学生・教職員向け無料"
        },
        {
          "id": "autodesk-maya",
          "name": "Maya",
          "provider": "Autodesk",
          "type": "license",
          "discount": {
            "type": "free",
            "duration": "学生・教職員期間中",
            "originalPrice": null,
            "studentPrice": 0,
            "currency": "JPY"
          },
          "eligibility": {
            "studentTypes": ["学生", "教職員"],
            "requirements": ["認定教育機関"]
          },
          "verificationMethod": "学生証明書",
          "url": "https://www.autodesk.co.jp/education/edu-software/overview",
          "status": "active",
          "lastVerified": null,
          "notes": "学生・教職員向け無料"
        },
        {
          "id": "autodesk-fusion360",
          "name": "Fusion 360",
          "provider": "Autodesk",
          "type": "license",
          "discount": {
            "type": "free",
            "duration": "学生・教職員期間中",
            "originalPrice": null,
            "studentPrice": 0,
            "currency": "JPY"
          },
          "eligibility": {
            "studentTypes": ["学生", "教職員"],
            "requirements": ["認定教育機関"]
          },
          "verificationMethod": "学生証明書",
          "url": "https://www.autodesk.co.jp/education/edu-software/overview",
          "status": "active",
          "lastVerified": null,
          "notes": "学生・教職員向け無料"
        },
        {
          "id": "autodesk-3dsmax",
          "name": "3ds Max",
          "provider": "Autodesk",
          "type": "license",
          "discount": {
            "type": "free",
            "duration": "学生・教職員期間中",
            "originalPrice": null,
            "studentPrice": 0,
            "currency": "JPY"
          },
          "eligibility": {
            "studentTypes": ["学生", "教職員"],
            "requirements": ["認定教育機関"]
          },